{
  "config_version": "2026-04-11-a",
  "site_id": "gh-01",
  "timezone": "Asia/Seoul",
  "catalog_ref": "sensor_catalog_seed.json",
  "poller_profiles": [
    {
      "profile_id": "modbus_rtu_fast_10s",
      "protocol": "rs485_modbus_rtu",
      "poll_interval_seconds": 10,
      "timeout_seconds": 2,
      "retry_count": 2,
      "retry_backoff_seconds": 3,
      "enabled": true
    },
    {
      "profile_id": "modbus_rtu_standard_30s",
      "protocol": "rs485_modbus_rtu",
      "poll_interval_seconds": 30,
      "timeout_seconds": 3,
      "retry_count": 2,
      "retry_backoff_seconds": 5,
      "enabled": true
    },
    {
      "profile_id": "modbus_rtu_slow_60s",
      "protocol": "rs485_modbus_rtu",
      "poll_interval_seconds": 60,
      "timeout_seconds": 5,
      "retry_count": 2,
      "retry_backoff_seconds": 10,
      "enabled": true
    },
    {
      "profile_id": "pulse_counter_60s",
      "protocol": "pulse_counter",
      "poll_interval_seconds": 60,
      "timeout_seconds": 2,
      "retry_count": 1,
      "retry_backoff_seconds": 5,
      "enabled": true
    },
    {
      "profile_id": "rtsp_capture_300s",
      "protocol": "rtsp_onvif",
      "poll_interval_seconds": 300,
      "timeout_seconds": 15,
      "retry_count": 1,
      "retry_backoff_seconds": 30,
      "enabled": true
    },
    {
      "profile_id": "plc_feedback_10s",
      "protocol": "plc_tag_modbus_tcp",
      "poll_interval_seconds": 10,
      "timeout_seconds": 2,
      "retry_count": 2,
      "retry_backoff_seconds": 3,
      "enabled": true
    },
    {
      "profile_id": "manual_batch_daily",
      "protocol": "manual_batch_import",
      "poll_interval_seconds": 86400,
      "timeout_seconds": 30,
      "retry_count": 0,
      "retry_backoff_seconds": 0,
      "enabled": true
    }
  ],
  "connections": [
    {
      "connection_id": "conn-gh01-rs485-zone-a",
      "protocol": "rs485_modbus_rtu",
      "transport": "serial_gateway",
      "endpoint_ref": "env:SENSOR_BUS_ZONE_A",
      "enabled": true
    },
    {
      "connection_id": "conn-gh01-rs485-zone-b",
      "protocol": "rs485_modbus_rtu",
      "transport": "serial_gateway",
      "endpoint_ref": "env:SENSOR_BUS_ZONE_B",
      "enabled": true
    },
    {
      "connection_id": "conn-gh01-rs485-weather",
      "protocol": "rs485_modbus_rtu",
      "transport": "serial_gateway",
      "endpoint_ref": "env:SENSOR_BUS_WEATHER",
      "enabled": true
    },
    {
      "connection_id": "conn-gh01-rs485-nutrient-room",
      "protocol": "rs485_modbus_rtu",
      "transport": "serial_gateway",
      "endpoint_ref": "env:SENSOR_BUS_NUTRIENT_ROOM",
      "enabled": true
    },
    {
      "connection_id": "conn-gh01-rs485-dry-room",
      "protocol": "rs485_modbus_rtu",
      "transport": "serial_gateway",
      "endpoint_ref": "env:SENSOR_BUS_DRY_ROOM",
      "enabled": true
    },
    {
      "connection_id": "conn-gh01-pulse-zone-a",
      "protocol": "pulse_counter",
      "transport": "plc_counter",
      "endpoint_ref": "env:PULSE_COUNTER_ZONE_A",
      "enabled": true
    },
    {
      "connection_id": "conn-gh01-pulse-zone-b",
      "protocol": "pulse_counter",
      "transport": "plc_counter",
      "endpoint_ref": "env:PULSE_COUNTER_ZONE_B",
      "enabled": true
    },
    {
      "connection_id": "conn-gh01-rtsp-zone-a",
      "protocol": "rtsp_onvif",
      "transport": "rtsp",
      "endpoint_ref": "env:RTSP_ZONE_A",
      "credential_ref": "env:RTSP_ZONE_A_CREDENTIAL",
      "enabled": true
    },
    {
      "connection_id": "conn-gh01-rtsp-zone-b",
      "protocol": "rtsp_onvif",
      "transport": "rtsp",
      "endpoint_ref": "env:RTSP_ZONE_B",
      "credential_ref": "env:RTSP_ZONE_B_CREDENTIAL",
      "enabled": true
    },
    {
      "connection_id": "conn-gh01-manual-dry-room",
      "protocol": "manual_batch_import",
      "transport": "file_drop",
      "endpoint_ref": "ops/manual/product_moisture",
      "enabled": true
    },
    {
      "connection_id": "conn-gh01-plc-main",
      "protocol": "plc_tag_modbus_tcp",
      "transport": "modbus_tcp_gateway",
      "endpoint_ref": "env:PLC_MAIN",
      "enabled": true
    }
  ],
  "sensor_binding_groups": [
    {
      "binding_group_id": "sensor-zone-a-climate",
      "connection_id": "conn-gh01-rs485-zone-a",
      "poller_profile_id": "modbus_rtu_fast_10s",
      "sensor_ids": [
        "gh-01-zone-a--air-temp-rh--01",
        "gh-01-zone-a--air-temp-rh--02"
      ],
      "zone_scope": ["gh-01-zone-a"],
      "parser_id": "modbus_climate_combo",
      "normalizer_id": "climate_sensor_normalizer",
      "quality_rule_set_id": "quality-climate-combo",
      "publish_targets": [
        "mqtt-sensor-raw",
        "tsdb-sensor-raw",
        "tsdb-sensor-snapshot"
      ],
      "enabled": true
    },
    {
      "binding_group_id": "sensor-zone-a-co2-par",
      "connection_id": "conn-gh01-rs485-zone-a",
      "poller_profile_id": "modbus_rtu_standard_30s",
      "sensor_ids": [
        "gh-01-zone-a--co2--01",
        "gh-01-zone-a--par--01"
      ],
      "zone_scope": ["gh-01-zone-a"],
      "parser_id": "modbus_scalar_environment",
      "normalizer_id": "environment_scalar_normalizer",
      "quality_rule_set_id": "quality-climate-combo",
      "publish_targets": [
        "mqtt-sensor-raw",
        "tsdb-sensor-raw",
        "tsdb-sensor-snapshot"
      ],
      "enabled": true
    },
    {
      "binding_group_id": "sensor-zone-a-rootzone-moisture",
      "connection_id": "conn-gh01-rs485-zone-a",
      "poller_profile_id": "modbus_rtu_standard_30s",
      "sensor_ids": [
        "gh-01-zone-a--substrate-moisture--01",
        "gh-01-zone-a--substrate-moisture--02"
      ],
      "zone_scope": ["gh-01-zone-a"],
      "parser_id": "modbus_substrate_probe",
      "normalizer_id": "rootzone_probe_normalizer",
      "quality_rule_set_id": "quality-rootzone-probe",
      "publish_targets": [
        "mqtt-sensor-raw",
        "tsdb-sensor-raw",
        "tsdb-sensor-snapshot"
      ],
      "enabled": true
    },
    {
      "binding_group_id": "sensor-zone-a-rootzone-temp",
      "connection_id": "conn-gh01-rs485-zone-a",
      "poller_profile_id": "modbus_rtu_slow_60s",
      "sensor_ids": [
        "gh-01-zone-a--substrate-temp--01",
        "gh-01-zone-a--substrate-temp--02"
      ],
      "zone_scope": ["gh-01-zone-a"],
      "parser_id": "modbus_substrate_temperature",
      "normalizer_id": "rootzone_temperature_normalizer",
      "quality_rule_set_id": "quality-rootzone-probe",
      "publish_targets": [
        "mqtt-sensor-raw",
        "tsdb-sensor-raw",
        "tsdb-sensor-snapshot"
      ],
      "enabled": true
    },
    {
      "binding_group_id": "sensor-zone-a-drain-ec-ph",
      "connection_id": "conn-gh01-rs485-zone-a",
      "poller_profile_id": "modbus_rtu_slow_60s",
      "sensor_ids": ["gh-01-zone-a--drain-ec-ph--01"],
      "zone_scope": ["gh-01-zone-a"],
      "parser_id": "modbus_ec_ph_station",
      "normalizer_id": "solution_ec_ph_normalizer",
      "quality_rule_set_id": "quality-liquid-chemistry",
      "publish_targets": [
        "mqtt-sensor-raw",
        "tsdb-sensor-raw",
        "tsdb-sensor-snapshot"
      ],
      "enabled": true
    },
    {
      "binding_group_id": "sensor-zone-a-drain-volume",
      "connection_id": "conn-gh01-pulse-zone-a",
      "poller_profile_id": "pulse_counter_60s",
      "sensor_ids": ["gh-01-zone-a--drain-volume--01"],
      "zone_scope": ["gh-01-zone-a"],
      "parser_id": "pulse_counter_volume",
      "normalizer_id": "flow_counter_normalizer",
      "quality_rule_set_id": "quality-pulse-counter",
      "publish_targets": [
        "mqtt-sensor-raw",
        "tsdb-sensor-raw",
        "tsdb-sensor-snapshot"
      ],
      "enabled": true
    },
    {
      "binding_group_id": "sensor-zone-a-vision",
      "connection_id": "conn-gh01-rtsp-zone-a",
      "poller_profile_id": "rtsp_capture_300s",
      "sensor_ids": ["gh-01-zone-a--crop-image-frame--01"],
      "zone_scope": ["gh-01-zone-a"],
      "parser_id": "rtsp_frame_capture",
      "normalizer_id": "vision_frame_metadata_normalizer",
      "quality_rule_set_id": "quality-vision-frame",
      "publish_targets": [
        "mqtt-vision-metadata",
        "object-store-vision"
      ],
      "enabled": true
    },
    {
      "binding_group_id": "sensor-zone-b-climate",
      "connection_id": "conn-gh01-rs485-zone-b",
      "poller_profile_id": "modbus_rtu_fast_10s",
      "sensor_ids": [
        "gh-01-zone-b--air-temp-rh--01",
        "gh-01-zone-b--air-temp-rh--02"
      ],
      "zone_scope": ["gh-01-zone-b"],
      "parser_id": "modbus_climate_combo",
      "normalizer_id": "climate_sensor_normalizer",
      "quality_rule_set_id": "quality-climate-combo",
      "publish_targets": [
        "mqtt-sensor-raw",
        "tsdb-sensor-raw",
        "tsdb-sensor-snapshot"
      ],
      "enabled": true
    },
    {
      "binding_group_id": "sensor-zone-b-co2-par",
      "connection_id": "conn-gh01-rs485-zone-b",
      "poller_profile_id": "modbus_rtu_standard_30s",
      "sensor_ids": [
        "gh-01-zone-b--co2--01",
        "gh-01-zone-b--par--01"
      ],
      "zone_scope": ["gh-01-zone-b"],
      "parser_id": "modbus_scalar_environment",
      "normalizer_id": "environment_scalar_normalizer",
      "quality_rule_set_id": "quality-climate-combo",
      "publish_targets": [
        "mqtt-sensor-raw",
        "tsdb-sensor-raw",
        "tsdb-sensor-snapshot"
      ],
      "enabled": true
    },
    {
      "binding_group_id": "sensor-zone-b-rootzone-moisture",
      "connection_id": "conn-gh01-rs485-zone-b",
      "poller_profile_id": "modbus_rtu_standard_30s",
      "sensor_ids": [
        "gh-01-zone-b--substrate-moisture--01",
        "gh-01-zone-b--substrate-moisture--02"
      ],
      "zone_scope": ["gh-01-zone-b"],
      "parser_id": "modbus_substrate_probe",
      "normalizer_id": "rootzone_probe_normalizer",